{
  "schemaVersion": 2,
  "kind": "capture-only",
  "status": "passed",
  "startedAtUtc": "2026-10-08T17:35:37.826Z",
  "finishedAtUtc": "2026-10-08T17:36:02.573Z",
  "sourceHashesStart": {
    "../../contract/constants.ts": "27cdd23112ea03f344457e6f6e6b5839ff536ebeadbba189751520353aa085ef",
    "../../contract/contract.ts": "c0f999c153074769c99c67ab2a71ad66c879e45e834713f3367b2bde4a1873d5",
    "../../contract/minigame-schema.ts": "2438655eeb8ca658543b475070e6fb3ccb3947f154f57caa3f619c87853c9bbb",
    "../../contract/player-count-schema.ts": "0748d9d9bcf795d0693c37a0f369b262fd8801dec9ab1e4a9a4f5ec23751a189",
    "../../contract/rng.ts": "7cfcf3024723607e8dd1ce6ccc5683a48d71fcc617947304cc5b9f6d3d7842fe",
    "fixtures/pack.json": "ef51e39b25c2569a9d0c29078535fa3392210887fdd515cd6278ca37284884af",
    "manifest.json": "1658ec6033494fd022c09e695ad5dd73c6c4282c94e03ec35a3ad0472b2eb33a",
    "package-lock.json": "043ab1f77fbf2a73d1576486cfd80afa8ecf80b44d43a69e1d9b789fc935e957",
    "package.json": "f08a0de245dc90515e807bd3dd32033fc07fe4579ffed07637bac6a5c8097b36",
    "play.html": "3147906fd5cc6454ea1fce7f6a79d58f0ba4b9d011ec27f351133107e20306a3",
    "scripts/check-data.mjs": "239073a6ad678610f733ea416cb4f09253f3470c1490735b6122a0b9e8431423",
    "scripts/check-hashes.mjs": "b253d4bb6ebff45c07577b6f8b3f192253b74dfcff14d2e0e1186dfafe99546b",
    "scripts/frame-coordination.mjs": "9fa771b41d14dc8a2dc5d039f41ffc8f2c39061db5126047c1f618b7e9a750be",
    "scripts/generate.mjs": "311b5560062318d7985bc64ad4d5c5e21b402e130bbaf29553c2681df96659a8",
    "scripts/verify-visual.mjs": "462de4751c344fe2581b1071535da23d7febaec99fbd2b6c53456398b693f388",
    "scripts/visual.mjs": "290784d2dbd549cd1afc13e088cdf1fb2fa6bec43b9c25cd928863ae39bca68a",
    "src/browser.ts": "cf785f942a4695fdfcd1641c63168ac565aa6ec47218348acc0c67d615e51a1d",
    "src/core.ts": "e1e6e366806d1c64a8b2e6fce03df3392e53a6c1b6a717d8bca1da23e167a82f",
    "src/generator.ts": "41b8e19bb20ec3fd3141eb57ae6d6597185e6eb4b6b176ed932a07ae7163a540",
    "src/geometry.ts": "6fd751db9d689fff70fc51fe26a8479fbc74c563ff9327da5b1ecddb13bf4bb4",
    "src/manifest.ts": "62c26eb8e931e3e66c9b210dae758c51bd89a7e53acc0d130da9facd31de2e6c",
    "src/reference.ts": "c944077d28097f377fdac1dba088cf4eec2aa44a970096e9181d562497e1cc74",
    "src/schema.ts": "f9e83ea4d3f09822efbd4ff74f496bc8cbf18c6d675a3be624a9c4a1b3a724d9",
    "src/solver.ts": "05618f3edec56105700bc47302ba6871fc5590e0f58441cb85d6ea8d2bbd621c",
    "src/study-total-baseline.ts": "e9db2ffa11a4723283776c60aa22bcccf1a78c1d25df53b06261fec49d853c17",
    "src/tiers.ts": "7b398ba9fc516e0be0f7fcd652b2643b5015af365e03bc76b4bbedb629b9aa50",
    "src/types.ts": "af5e7eb07b55a1bf7332fc7c3e1aecdfd0616f9530771cafbea772bb8574ad5b",
    "web/template.html": "3a1d2307233addf399fbf687481f66ee6819eb02daf6649256435b2f62d43f80"
  },
  "sourceHashesEnd": {
    "../../contract/constants.ts": "27cdd23112ea03f344457e6f6e6b5839ff536ebeadbba189751520353aa085ef",
    "../../contract/contract.ts": "c0f999c153074769c99c67ab2a71ad66c879e45e834713f3367b2bde4a1873d5",
    "../../contract/minigame-schema.ts": "2438655eeb8ca658543b475070e6fb3ccb3947f154f57caa3f619c87853c9bbb",
    "../../contract/player-count-schema.ts": "0748d9d9bcf795d0693c37a0f369b262fd8801dec9ab1e4a9a4f5ec23751a189",
    "../../contract/rng.ts": "7cfcf3024723607e8dd1ce6ccc5683a48d71fcc617947304cc5b9f6d3d7842fe",
    "fixtures/pack.json": "ef51e39b25c2569a9d0c29078535fa3392210887fdd515cd6278ca37284884af",
    "manifest.json": "1658ec6033494fd022c09e695ad5dd73c6c4282c94e03ec35a3ad0472b2eb33a",
    "package-lock.json": "043ab1f77fbf2a73d1576486cfd80afa8ecf80b44d43a69e1d9b789fc935e957",
    "package.json": "f08a0de245dc90515e807bd3dd32033fc07fe4579ffed07637bac6a5c8097b36",
    "play.html": "3147906fd5cc6454ea1fce7f6a79d58f0ba4b9d011ec27f351133107e20306a3",
    "scripts/check-data.mjs": "239073a6ad678610f733ea416cb4f09253f3470c1490735b6122a0b9e8431423",
    "scripts/check-hashes.mjs": "b253d4bb6ebff45c07577b6f8b3f192253b74dfcff14d2e0e1186dfafe99546b",
    "scripts/frame-coordination.mjs": "9fa771b41d14dc8a2dc5d039f41ffc8f2c39061db5126047c1f618b7e9a750be",
    "scripts/generate.mjs": "311b5560062318d7985bc64ad4d5c5e21b402e130bbaf29553c2681df96659a8",
    "scripts/verify-visual.mjs": "462de4751c344fe2581b1071535da23d7febaec99fbd2b6c53456398b693f388",
    "scripts/visual.mjs": "290784d2dbd549cd1afc13e088cdf1fb2fa6bec43b9c25cd928863ae39bca68a",
    "src/browser.ts": "cf785f942a4695fdfcd1641c63168ac565aa6ec47218348acc0c67d615e51a1d",
    "src/core.ts": "e1e6e366806d1c64a8b2e6fce03df3392e53a6c1b6a717d8bca1da23e167a82f",
    "src/generator.ts": "41b8e19bb20ec3fd3141eb57ae6d6597185e6eb4b6b176ed932a07ae7163a540",
    "src/geometry.ts": "6fd751db9d689fff70fc51fe26a8479fbc74c563ff9327da5b1ecddb13bf4bb4",
    "src/manifest.ts": "62c26eb8e931e3e66c9b210dae758c51bd89a7e53acc0d130da9facd31de2e6c",
    "src/reference.ts": "c944077d28097f377fdac1dba088cf4eec2aa44a970096e9181d562497e1cc74",
    "src/schema.ts": "f9e83ea4d3f09822efbd4ff74f496bc8cbf18c6d675a3be624a9c4a1b3a724d9",
    "src/solver.ts": "05618f3edec56105700bc47302ba6871fc5590e0f58441cb85d6ea8d2bbd621c",
    "src/study-total-baseline.ts": "e9db2ffa11a4723283776c60aa22bcccf1a78c1d25df53b06261fec49d853c17",
    "src/tiers.ts": "7b398ba9fc516e0be0f7fcd652b2643b5015af365e03bc76b4bbedb629b9aa50",
    "src/types.ts": "af5e7eb07b55a1bf7332fc7c3e1aecdfd0616f9530771cafbea772bb8574ad5b",
    "web/template.html": "3a1d2307233addf399fbf687481f66ee6819eb02daf6649256435b2f62d43f80"
  },
  "wallClock": "Date.now frozen by host; native RAF timestamps unchanged",
  "rawFiltering": "none",
  "captureDuringSamples": false,
  "physicalPhoneMeasured": false,
  "desktop": null,
  "phone": null,
  "failure": null,
  "requests": [
    "file:///workspace/game-cores-G03-resume/jobs/G03-pack-the-hold/play.html"
  ],
  "errors": [],
  "documentUrl": "file:///workspace/game-cores-G03-resume/jobs/G03-pack-the-hold/play.html",
  "chrome": "HeadlessChrome/141.0.7390.37",
  "fileOpened": true,
  "serving": "disk",
  "reducedMotion": true,
  "externalRequests": 0,
  "runtimeExceptions": 0,
  "completedTwoPlayerGame": true,
  "completedPlayerCounts": [
    2,
    3,
    4,
    5,
    6,
    7,
    8
  ],
  "pointerDrag": true,
  "touchDrag": true,
  "keyboardFocus": true,
  "keyboardPlacement": true,
  "longNamesFit": true,
  "videoFile": "milestone-13.webm",
  "videoBytes": 103087,
  "videoSha256": "a80f6086b29333183121fcfb0f4bcaf4c2a50e5b6f6b2cab187ef1f33590b912",
  "encodedVideoFps": 10,
  "videoScope": "36 separately captured real UI images; encoded10fps is not rendering acceptance"
}
